text,n_likes
"Depends on your perspective.. For me, TeleVue is the $2000 speakers, not the $10,000 ones.. And to keep the analogy up, in this case the $2000 speakers ARE the equal of the $10,000 ones..",0
"Where ever you want to peg the relative comparison, the point is the same. If TV eyepieces are the 2K speaker, then they are beat out by the $500 speaker that performs 50% as well as the $2,000 speaker. IE - Televue eyepieces are higher on the curve of diminishing returns than other eyepieces, in terms of performance per dollar. They do not represent the best value, but they clearly represent sufficient value for many to justify the cost.",0
It is a sad commentary on our entitlement society and educational system that so many people do not get the concept of the free market and voluntary value-for-value exchange..,0
"Maybe, Jeff, but sometimes the manufacturers and retailers take the concept too far and use marketing to get an exorbitant price for an item that is not worth it.  I'm not saying TV eyepieces are not worth the price, nor am I saying that they use marketing to any great degree as they don't need to and their quality speaks for itself, but whatever concept you want to believe in they are still expensive..........and that matters to those who want to obtain a TV eyepiece but find the price prohibitive.   Astronomy can be/is an expensive hobby depending on what level you want to take it to but let's face there is a lot of astronomy kit out there that is over priced.",0
"Film never LEFT for a lot of us!. I just bought some 4"" x 5"" for my Speed Graphic!!!",0
"They don't get the concept, or they don't agree with it? Plenty of people understand the notion that value is equal to what the market will bear, yet also disagree with that definition.",0
"Price is what you pay, value is what you get..",0
Right !.,0
"If Tele vue eyepieces were underpriced, no one would buy the bottom feeder brands..",0
Now there's a concept I can get myself wrapped around.,0
"Agree, it's a shame Astronomical companies are so few in number and don't have the leverage. If they did have that they could make terrible business decisions, over extend and basically fail bigly, pay no tax for 5 years and let the tax payer pick up the tab. Yup the not so free market. Sad. Heck Meade and Celestron might still be US owned if they could have got the same bailouts.",0
"Tele Vue has a sale on eyepieces once or twice each year. That is the time to buy. When purchased on sale, Tele Vue eyepieces, IMHO, are fairly priced given the high quality..",0
"LOL! It ain't the ""educational system"" you should worry about! It's the terrible students, who, academically, are well behind those of every other advanced industrial nation!!.",0
"Wow, where did all the young people bashing come from?.",0
It came from a sad commentary on our elitist society where people shame others for having a different point of view from their own..,0
"If people buy them, and many do, then they are worth it to them. Luxury products can demand a higher price at smaller sales volumes.. Free markets allow suppliers to set their prices (and corresponding supply quantities). Customers may desire certain products, but some may not seem worth the price, and those customers can chose to buy better value options.. My personal opinion is Televue sought higher than normal profit for their Ethos eyepieces, and that opened the floodgate for 100-120 AFOV competitors at lower prices. If Televue would have initially set their Ethos prices lower, they would have been able to keep this niche market; since competitors would have perceived less to gain if they entered that market..",0
"Televue does have the best quality, and may people pay lots of green for the green lettering. Others pay less for lower cost better value eyepieces from competitors..",0
"For whatever it's worth. I don't think Tele-Vue has huge margins. I think it's correspondingly more expensive to produce products in the zone of diminishing returns. They also probably put more work into fit and finish, which costs extra money and many people won't find necessary. Like anything else where one has to spend 50% more for the last 15% of performance, I don't think they make sense for everybody.",0
"Optically the Nagler T-6s are better in every way than the TMB Planetary eyepieces. And the 12mm, 16mm, 20mm Type 2 Naglers are superior optically in just about every way to the 16mm and Meade Series 5000 SWAs... And optically the 31mm Nagler has it all over the 32mm TeleVUe Wide field.. But there is more than optics and the TMB Planetary + Meade + TV WF do a good enough job and are much easier to manage. No 2 pound plus eyepieces, no trying to figure out it's the 7mm T-6 or the 5mm T-6.. My point was that tracking a Dob is not that big a deal with 60 degree AFoV eyepieces.. Or even 50 degree eyepieces. Jon.",0
"The error in both situations is thinking that because you like it, because it works for you, that it's best for you, that it is also best for the other guy (or gal) too. This is a hobby, it's about recreation, about enjoyment, about learning, about whatever it is you want it to be about.. The things we do, whatever it is, technology has long since passed it by. I guess you could argue that imagers are using modern technology but few are doing anything more than taking pretty photos to look at. No doubt about it, they are taking amazing photos but it's recreation and what works for you, that's what it's about.. Jon. P.S. In case you missed it, I love my Dobsonians and my refractors...",0
"50% of almost perfect is still almost perfect... One similarity between eyepieces and speakers...  the magic is not in the equipment, it's in the skies above, in the music. A scratchy recording made with a single microphone of Louis Armstrong... can't beat that magic.... Jon.",0
"Not when they're on sale! 15% or 20% off, minus 10% or 12% off from some vendors, was mighty nice.. Mike.",0
In case you missed it also I enjoy my RC's and my Refractors. Enjoy the holidays and hope the New Year is a good one..,0
"Or some good old Blues like John Lee Hooker just jamming. Guess I'm getting older but my ears now don't have the high range they used to. I still like the high end system I put together, but some of the new stuff that can serenade bats or burn out tumors, its nice and it boosts the harmonic content but is now beyond my ability to notice the difference from my existing system..",0
"""Astronomy"" to Millennials is looking up Hubble and space probe pictures on the web. There is a kind of efficiency about that..",0
I disagree. That's like saying everyone over 40 only star hops..,0
"(Edited to be less needlessly inflammatory). I don't know if it's that. Millenials, which I identify with despite being on the older end of the group (35), face unique pressures that make astronomy harder and less rewarding. Pay is down and hours are up, so hobbies in general are kind of reduced in prominance. Also, light pollution increases the time commitment needed to stargaze, and many people just don't know it's even a thing because they've never seen a really good sky.",0
"I disagree. That's like saying everyone over 40 only star hops.[/quote]. I remember when I started in 2000 many old timers were dead set against goto setups.   They were especially hard on newbees.   They had a point about first learning the sky, but some were dead set against any type goto setup.  When I purchased my Orion 8"" intelliscope I was almost ashamed that I dared go with a push to setup.  Now, it is understood how goto's and other tech advancements help the hobby.  I'm glad I spent the better part of 2 years learning the sky without any other help but charts and star hoping.  But I really enjoy some of the advanced tech availabile.",0
A lot of folks do things the opposite way too. They get a goto mount and get started then get a dob to augment what they have and find their way around.. I tell a beginner if asked that they don't need to learn the Sky unless they want to. Computers make it optional now. Get out and enjoy and it's a less frustrating way to learn..,0
"It's very useful, as it keeps the young folk out of the hobby. We old folk only deem young people worthy, who can put up with our bashing. Rite of passage and all that.. ​. ​Now get off my lawn! ​. ​Edit: I forgot. I don't have a lawn.​",0
"Agree. The disdain I see from the older generation for younger generations on this board is somewhat incredible - and dare I say - rich. It is easy to look down your nose at a new generation - old timers have been doing it since timeimmemorial - but take a second to consider being raised in a time when you can see 10 stars in the sky and half the sky is blotted out by buildings. Then add in the fact that reaching decent skies requires a car (which limits you to people who can convince their parents to drive them or are over 16). Then add in the fact that the job market is far more competitive than it was in previous generations, the expectation of participation in copious numbers of extracurricular activities is up, parental trust of their kids to roam outside is down, the prospect of economic security is down (especially since our parents generation ran up the national debt and we don't think we will have social security when we retire), then add in the fact that children's parents are placing phones in their hands at 4 years old because they are easy and keep the child occupied. Then ask yourself: had I grown up in this environment, would I be interested in astronomy?. Maybe the older generation should look in the mirror at the actions they have taken - and the society they have left for their children - before criticizing them as somehow inherently lazy or uninterested. Note: I am not pointing these comments specifically to the above poster - but more generally to the sentiment which I see all too frequently..",0
"Well, dgoldb, don't let your irritation let you fall into the same trap by pointing fingers at the older generation because of people who point fingers at the younger generation........which achieves nothing.  I'm of the older generation and don't take blame for the state of the coffers of my country, the changing technology leading to a change in culture and society, or for Climate Warming, nor do I think that the younger generation is either lazy or uninterested in their own or the world's future The older generation was no different to the present generation, we had the same problems, the same desires, the outlooks relevant to the times they were in, etc so don't let other people's possible narrow view of Life make your finger point in the wrong direction. So, getting the thread back on track, I think Televue ep's are expensive but the quality does make up for that, I guess.  We all have to watch our wallets and perhaps delay getting the ep that we most desire, but when we finally do get it there is that glow of achievement and satisfaction that makes it all worth while.  Young or old, there are a lot of amateur astronomers who struggle to find the money to get the best they can so that they can do what they like best.........staring at the Stars.",0
"If your Dob is set up right, it shouldn't be an issue going from a 6oz eyepiece to a 2 pound eyepiece. If you're just observing by yourself or maybe one other person, I can understand that 50 or 60 degree eyepieces are okay for you even though this is almost 2017 after all. I hated that ""looking-down-a-tunnel"" viewing back in the day. I want to minimize placing anything between me and outer space, that includes eyepieces. An ""engaging"", ""immersive"" eyepiece is not a 55 or 60-degree eyepiece, it's an eyepiece that tends to just get out of the way, so that you almost don't even know it's there! And a wide field of view (among other things) really helps in that department. For planetary viewing, it doesn't matter that much but, for deep-sky, a 70+ degree wide field is an essential part of observing enjoyment in my opinion. And when it comes to outreach, I demand (of myself) that I show people the best possible views, so they can get the most enjoyment. Toward that end, I avoid eyepieces that have kidney-beaning, short eye relief, tunnel-vision or other problems. I also like the fact that, with an 82-degree eyepiece, two or three people can go up and down the ladder before I have to break the continuity of things by moving the scope. So call me opinionated but, when it comes to deep-sky, whether just for me or in conjunction with public viewing, 70-degree-plus eyepieces are simply a much better all-around experience..",0
"The point was not to point fingers but rather to encourage people to look in the mirror before blaming others. My generation certainly has short comings, as does the previous. I try and focus on the former, but I'm not going to sit around while people in glass houses throw stones at my generation.",0
"Well, I'm no Wise Man, dgoldb, but I have learnt that most people who criticise other people or generations usually don't like to, or won't, look into ""the mirror"" to see their own faults and short falling's   I doubt if there is any generation or person that hasn't, or doesn't, lived in a ""Glass House"" of some kind.  Me?, I let the arrows of personal opinions, narrow, biased, views either bounce off or go over my head as it's better for the blood pressure, [,mental and physical], otherwise you'll be continually getting irritated and throwing ""stones"" back.  I always remember the Beatles lyric, [my age is telling!!], ""Life is too short for Fussing and Fighting, my friend""",0
"Some of us stand up for the young. Social security was used as a loan system by both parties. Now they have to pay it back some are trying to have a fire sale. The young are showing they will do ok, they are much more agile with change. It seems from the younger folks I work with that personal time is a bigger driver than extra money.. They are more realistic than the ""better to complain than retrain"" segment of society.. Looking forward to the millennials to come into their own. They will be the generation that will keep the planet habitable and hopefully bring back dark skies..",0
Come not between the dragon and his wrath. - King Lear.,0
"It's true about the wide view versus the normal 50 degree FOV.   If ur a planet person wide view is not as important as transmission, contrast, sharpness etc. That is why I have various plossls on the same FL.  I have 3 TV Plossls and a TV 3x Barlow.   I prob started off the debate per this thread when I wrote that my TV plossls are not so much better than my other brands.   For instance my Meade series 4000 and even my Orion Serius plossls give them a run for their money.   And the Meade and Orion plossls are about 1/2 or even 1/3 the cost.    With that logic I said I felt the TV plossls were overpriced.",0
"All astro gear is expensive, some more so than other, the issue of value and disposable income - for myself, none of it inexpensive when it comes down to it. I have owned a lot of TV eyepieces and never felt like I got burned or the quality substandard, and that in bold type. I am willing to pay a premium as there is a company behind these eyepieces, humans that answer the phoneor email that know what they are talking about or will get me to one that does, even theowner, no matter if I bought full price from them or not... no complaints about price or value on my part.. I know over the years there has been many, many, many timesI wisheyepiecesI wanted cost less than they did, but patience and time I either get it or not. Then I have to later decide doI keep it or not.....",0
"I have no idea what you mean, Ardent     , although one of my favourite quotes about Dragons is ""Meddle not in the affairs of Dragons, for thy art crunchy and good with Ketchup""",0
"Very true, for planetary I use Brandon's in a Vernonscope Binoviewer in a Skylight 6"" F15. Class glass all the way..",0
"For about $100 I can buy a TV Plossl or a UO HD ortho, and both are high end.. In that perspective, it's not clear TV are ""overpriced."".",0
"I hate looking thru a straw FOV for planets. I love the 60 and 62, 82 degree of the Radians, Delite and Naglers for planets. I never noticed one hoot of a diff from many elements to so called planet killer eyepieces. Short ER and narrow FOV are a killer in my book.. Plus i never use my drives and use super high powers so a wider FOV is better..",0
"The 9mm and 12mm orthos have good eye relief, and Barlows allow using 15mm and longer Plossls.. Planets are small, so FOV isn't critical. But I do have TV Delites and Pentax XWs so I understand FOV and eye relief on planets.. However there is something crisp and contrasty about simple eyepieces on planets. They are also fun and relatively inexpensive..",0
Hey! I resemble that remark! I've been star hopping for over (gosh!) 30 years. Used a smidge of GoTo in the early 2000's... didn't care for it much. Made finding the objects WAY too easy with my LXD-75. And I kept trying to put coffee beans into my ETX....,0
"""Are Televue eyepieces overpriced?"". Of course they are--but it appears that they are the best thing since slice bread!. Until some body comes out with a better mouse trap!. In every field (of interest) the same phenomenon happens!. I ""observe"" a similar phenomenon in cycling gears, photography and of course audiophile!. Competition and marketing is what is all about!.",0
"I have purchased 3 TV plossls; my most recent purchase the 8mm a yr ago.  I understand the a person can and often purchases an eyepiece even if the cost appears excessive.   But that doesn't mean the EP is not overpriced.  Here is what I think:  to decide if an EP is overpriced u would have to establish a baseline.  What constitutes an average price in that category.  Since I was only commenting on plossls I would submit that good plossls can be purchased for $35 each.  This is a bit more the the price of the Meade 4000, and other name brands such as Celestron's Omni series and Orion's Sirius plossls.  Those are all good performers.. My experience has led me to believe the Orion Sirius line is a bit better in the short FLs.  For instance, the 6.3 and 7.5mm EPs are really nice and provide top notch views.  I have found the Meade 4000 excels in the mid ranges.  It's 12.4, 15, 20, and 26mm are all very good EPs.  The 26 is a very nice and versatile EP and provides nice views alone or when used with several of my barlows.   I really like the 15 and 20.  Now, my 8mm TV is a fine EP, but it has a limited FOV and a very tight eyerelief.  It is not noticeable better then the Orion 7.5.   In direct comparison with the Meade 4000, I have not found the TV 15mm plossl to be visually superior.   I believe the TV 11mm is a top planetary EP.  It consistently provides better views than any other plossl EP close to its focal length.   Since the competitive EPs provide substantially the same view as the TVs with the exception of the 11mm,  one has to look at the price of the TV plossls. They usually cost $90 to $100 each or nearly 200% more than the competition.   Since the views provided are very similar it is hard to miss the conclusion concerning plossls only: TV plossls are overpriced.  Using this criteria it didn't matter if TV outsells the other brands.  Just because people ignore the stats does not make the stats meaningless.  If a competitors EP can provide a similar view at 1/2 or less the price, then your EP has to be overpriced.  You might overcome that problem with clever marketing, but even if you do, your eyepieces is still overpriced.",0
"It depends on materials used and quality of construction as well, not just the performance. If this was the case, one would say that a Porsche is overpriced when compared to a Toyota Supra - let's say both having equivalent acceleration and horsepower. Look, this horse is long dead. We live in a consumer orient d society. What one person finds overpriced, someone else may consider inexpensive. There is no baseline.",0
The only thing overpriced (at least on the Delites) are the incredibly poor fitting eyepiece caps on both top and bottom.. Eric.,0
"I have to disagree.  We are comparing very similar products.  Not only eyepieces, but specific types of eyepieces: plossls.  The Meade 4000 are particularly well made.  They use the same type of glass,  coatings, and general  construction.   These are not horses and cars, not Fords compared to BMWs with similar engines.   These are very similar eyepieces that are well made and provide similar images.  When you write TVs are better in terms such as materials and construction you are in essence making my point.  There is no proof that the materials or construction of the TV plossl is better than that of a Meade 4000.   By what standard?   Does the TV last longer?  Does it have a nicer appeal?   I have owned several of both lines and the biggest advantge of the TV is that it's info is engraved into the housing while the Meade is painted.  After much use the Meade tends to wear off.   In my opinion, hardly worth a doubling in price.",0
"Eric,. Your comment is spot on. Unfortunately, this extends to the entire range..",0
"Lenny,. It's the age old discussion of Japanese Vs Chinese Vs Taiwanese. Labor costs in some markets cost more. QC costs more. Also, there is a guy working at TV who does QC on every single eyepiece. So, everything gets shipped to TV, then gets checked, then gets shipped out again. Furthermore, TV continues doing R&D which then other companies simply copy.. All the above COST MONEY. Money that is then added to the price of an eyepiece. Whether one chooses to support the above working ethos / business practice is a personal matter.Others have of course disseminated the designs of Tele Vue and produced similar products. This has long been discussed and let's not get involved in the ethics of this, but my own personal preference (emphasis on own personal) is for me to support the people doing the R&D i.e. Tele Vue. Not only that, but I love the fact that I can call Tele Vue and get uncle Al on the line.. Each of has their own choice to make when buying an eyepiece. Each of us has their own criteria. This topic really is asking something that is of a personal nature and cannot truly be quantified. Me, I'll choose Tele Vue over any other eyepiece for the above mentioned reasons. Call me silly if you want, I don't mind. I would rather save a bit more and get something to which I can then feel a personal connection as it relates to my own values in life.. de gustibus non est disputandum....",0
"I will add to this topic some personal information. I am an auditor and have also worked in the industry as a CFO for 8 years - total 21 years experience in the field of accounting, auditing, finance and business development.. I have done business plans / feasibility studies / product costing e.t.c. to such an extend that I can tell you that most people posting here are posting based on their own personal experience, not from business knowledge of the industry - or any industry for that matter.. These are the prices that Tele Vue charges. They also have about twice a year a sale. There is also the pre-owned market. Lot's of choices. Buy 'em if you want, don't buy them if you don't. But calling them overpriced without knowing the price structure behind the product is an unsupported assertion.. Calling them overpriced Vs another similar product is another story if one ignores R&D, QC, material cost and after sales support. IF ONE WERE TO IGNORE the 4 parameters I list, then go ahead and call them overpriced..",0
"We can discus business ethics if you prefer, but that was not the original question.  If one wishes to support TVs R & D etc is a personal decision.   But, if you take the conversation in that direction it's hard to say where it will end up.  So, I am only answering the original question, are TVs overpriced?   For whatever reason; R and D, qualify control,  the answer is yes.",0
"Based on your own criteria and ignoring R&D, QC and other factors, then yes. Based on my own criteria, no.. But that's the beauty of it. We can agree to disagree in a civilized matter",0
Ok. Sounds good to me.,0
"Okay, so Tele Vue Plossls cost twice as much (actually about 2.5x as much) as Meade Plossls. I'd be willing to bet that, for the most part, the person who chooses Tele Vue Plossls over Meade Plossls does so because they just can't stand the feeling of looking through a Meade and wondering if they're actually seeing every detail or not. The Tele Vue purchaser has no doubt at all...every detail IS right there in the eyepiece...nothing is missing! For a huge number of observers, any eyepiece that can provide that kind of confidence is...PRICELESS!.",0
"I would agree and here comes a term that Lenny used a while ago. Goodwill.. Although goodwill is something that arises from the purchase of a business typically (difference between price paid and net book value of separable net assets), in this case let's call it the premium one is willing to pay to buy a product where expectations are that performance will be top notch and there will be few if any product quality problems.. That in itself has a certain value attributed to it, a premium which is added to the price of the product....",0
"Am I the only one who doesn't find much remarkable about Tele-Vue plossls? I have one I got with a used scope I bought, and I'm pretty sure I could not differentiate it from a regular high quality plossl.",0
