text,n_likes
Are they really worth the price (despite being manufactured in Taiwan for some of them) or do you pay mega premium prices just because of the Televue tag?. Honest and ego-free replies please!.,0
"If you want a lunar instrument mainly, then yes..",0
I say it depends on the person and series.. I've tried all the 30ish mm eyepieces and nothing can match the 31T5 IMO.. Closest was probably the ES 30mm 82 but i found it lacked sharpness and had a greyish background.. Ethos I found the same and have now sold my ES 100's. The ES are a tad more comfortable to use however.. These are subtle differences but are noticeable.. Mike.,0
"Not on the used market... A lot of what you're paying for with Tele Vue eye pieces is good correction in fast scopes. I use fairly simple eye pieces in my slow scopes and enjoy the views just fine. For example, I have the three old Orion Optiluxe eye pieces (32mm, 40mm and 50mm). In my f/10 and slower scopes they do well. In friends' f/6 and faster scopes they are terrible. Those friends have 41mm Panoptics and 31mm Naglers.. I'd also read somewhere that when Al Nagler was asked about other companies cloning Tele Vue products, he said he wasn't worried because they'd never duplicate Tele Vue coatings. So perhaps there is also a premium for coatings..",0
It is a well known phenomenon that people feel a wine taste better if they think it is more expensive. I was thinking the only way to settle whether TV is overpriced is to conduct a blind shoot-out of various eyepiece at matching focal lengths and equipment where the eyepiece makers/model is hidden from the observers. The results of such an experiment would be interesting to say the least.,0
"I don't think they're overpriced, though I don't own any of them. They are extremely good eyepieces, right at the very top of the ""food chain"" and I think it's OK for them to cost somewhat more.. Myself, I am on a very limited budget, so I buy ES, when I want wide-field eyepieces, but if I could afford it, I would go with Televue and not look back. I do have a Televue Paracorr, which I am extremely fond of.. Clear skies!Thomas, Denmark.",0
"I personally can't justify TeleVue price tags with my current level of experience. The way I see it, they're only worth the premium price if you can appreciate the benefits they provide. Inexperienced users, such as myself, are not likely to notice a drastic difference in perceived transmission or aberration correction properties, so they're only worth it if you know what you're looking for.. My personal approach is to start out with comfortable mid-range eyepieces as seen in my signature (Baader, Vixen, Explore Scientific) and use them until I develop enough observing experience to warrant spending the extra cash on TV and other premium brands. I would like to first exhaust the utility of my affordable kit before I fork over double to triple the cost for premium glass..",0
"In other words, posters #4,5 and 6 don't own any TV ep's..",0
"If they were overpriced, they wouldn't sell any and they would go out of the eyepiece business..",0
"I suppose the answer is they sell enough to perform development and bring new products to market. They seem to come up with a lot of new ideas. The company is doing something right and its bread and butter is selling eyepieces.. To counter the comment that haters aren't owners.. I own a pairs of 8 Radians, 16T5, 22 and 24 mm Pans and a 41 Pan. I've tried Ethos and the 31 T5. I also have pairs of 6, 10 and 14 Delos.... Apart from the Delos, the only Televue eyepieces I really like are the 22 Pans. and they're not made any more.. I doubt Al actually cares - he already has my money.",0
"Me too. I used a pair of Plossls and a barlow for decades and was perfectly happy with what I could see. Eventually, I began to consider upgrading to some GSO widefields in a 2"" barrel.. I oncehada conversation where I made this very statement. It wasat a star party one afternoon a few years back. About four hours later, a set of Ethos eyepieces was sitting in my lap after my raffle ticket number came up. I cannot speak for others as to whether TV is worth the premium price. But you WILL be able to notice the difference!.",0
"Hi,. Some context - I'm a (glasses wearing) visual-only observer and focus exclusively on DSOs.. I own a number of TV (Delos, Panoptics, Naglers & 1 Ethos) eyepieces - some I got used, the rest I paid retail.. Over the years, I've tried other EP manufacturers - I kept none. What I didn't give away, got tossed. You did ask for honesty, yes?. Do I think my TVs were overpriced? Nope! Otherwise, I wouldn't have bought them, nor would I still own them Best..,. skybsd.",0
"Compared to other things, astronomy always seems to carry high prices for its gear. These eyepieces are marketed toward people who can afford them and they seem to sell well. There are other options if you don't want to spend that kind of money. You can get most of the way there with other brands of eyepieces.. Anyone who ridicules you for not having them or says you're not really doing astronomy unless you have them is being childish.. I have a feeling that you're going to get your face bitten off for asking this question though..",0
"They are not overpriced for me. I personally enjoywide field eyepieces (100 degrees). I havetriedother brands and Televue eyepieces are consistently sharper in the outer edges of the view.The others? Not so much. It's as simple as that for me. YMMV.. Cheers,. Ron.",0
"I believe the standard (and applicable) reply is:. If you have to ask, then, yes, they are.",0
"Actually, not true, at least in the case of Poster #4. What I don't have are:.  - the long focal length Naglers or Panoptics, as I like my Optiluxes just fine. I do find myself coveting the now discontinued 26mm, though. My opinion would be different if I had an f/5 scope, too..  - the Ethos. I can take in the Nagler field just fine, but the Ethos field is too big for me..  - the Delos or DeLites, as I'm happy with the eye pieces I have.. I do have:.  - some Naglers; the 17mm is magical and got the whole ""Nagler fever"" thing started for me. The view of M3 in my refractor was just too much to ignore..  - some Radians.  - some Plossls, I especially like the smoothies which I use with my driveway scope at home.  - two classics: a 13T1 and 24mm wide field. A bit of functional history that provide proof to me that Tele Vue's current eye pieces are demonstrably better than their old eye pieces (except for the Plossls, the smoothies are cool)..",0
"Evaluating an eyepiece is not a subjective judgment like wine is.. With an eyepiece, there are definite, observable aberrations, distortions, phenomena, one can objectively evaluate an eyepiece for field curvature, off axis astigmatism at faster focal ratios, scattering and ghosting. The uniformity of the illumination across the field of view, the field of view, the eye relief, angular magnification distortion... Myself, in the comarisons i have made between TeleVue eyepieces and others is that in my Scopes, which are generally on the fast side, TV eyepieces are sharper at the edge of the field, they suffer from less scatter than similar eyepieces, the field is evenly illuminated without the bright edge that some eyepieces are know for.. I think TeleVue makes excellent eyepieces and sells them at a reasonable price. I don't think Uncle Al has secret Swiss bank accounts, he has made a comfortable living from conceiving, designing and providing the most innovative eyepieces the hobby has seen. Hopefully he gets his just due and those copying his designs don't take too much business away.. I think Thomas Jensen was right on target. They're right at the top but there are eyepieces that are quite good but more affordable.  Myself, I am thrifty by nature but in my retirement years, amateur astronomy is my main interest. I am fortunate enough to have some very nice telescopes and having a nice set of TeleVue eyepieces is a luxury that I can afford. But back to Thomas, he has a good set of eyepieces but more importantly an amazing set of eyes, what he can see..oh my.. I'd gladly trade my eyepieces for his if I could also end up with eyes like his in the bargain.. Jon.",0
"Hopefully no one ridicules anyone in regards to their equipment.  Myself, I have been fortunate to acquire some quite nice equipment. It has taken around 20 years.. Not quickly.. But I very much respect and admire those of us who use basic equipment and use it effectively. Sometimes I think I am the guy with the fastest car on the track but I'm the slowest driver.. Jon.",0
"I brought up this point only because I seen endless maker vs maker in forums with no resolution in sight. (I've read some who commented that $10 Vites 26mm held its own vs Pans and so on). Given the limited resources of time and money most of us have, it would be nice to see if TV or other premium brands stand up to scrutiny of a blind test, however subjective that test might be..",0
"Are TV ep's over priced? I would say.... No, if you can afford them. Yes, if you can't afford them.. Right now, for me, they are over priced, but I don't care as I am happy with what I have..",0
"This seems to be a question regarding just about any Premium brand piece of gear, scope or eyepiece. Because TV so ubiquitous, it seems to get this question asked more often.  I can understand this feeling myself. When i started out I bought a 10 inch Orion dob, an 35mm panoptic and a 7 mm Nagler.  I distinctly remember feeling a bit uneasy that the two EP's I bought cost more than the telescope at the time. Over the years, I have added a few more TV's to my collection as well as a set of Brandons and I feel they are all worth what they are charged for retail. I can absolutely tell the difference in performance, and here is the important part of the sentence, that difference is worth it TO ME PERSONALLY.  I am in a position that I can afford it, and have progressed enough in the hobby where small differences in clarity and contrast really stand out to me. That being said, I ALSO own a bunch of very fine University Optics Orthos and ERFLEs that I use often and I can recommend to anyone. They are budget friendly and their quality is really quite good, much better in my opinion than the run of the mill chinese Plossl clones(and often cheaper!). I have a Surplus Shed special 53 mm that I got for I think 20 dollars, that has sufficiently quelled my desire for getting the TV 55 mm Plossl. I am sure as the sun rises that the TV would be better, but for what I use that surplus shed for, it is sufficient given my budget constraints.. As to the following comment posted above: ""Anyone who ridicules you for not having them or says you're not really doing astronomy unless you have them is being childish."". That is certainly true for ANY piece of gear!. I can have as much fun with my 120mm Synta Achromat as I do with my 5 inch AP Starfire.  It is not about the gear, it is about looking at and appreciating what is in the Sky!  Very often there is too much ridicule going on either for or against one piece of gear or another. It is all very silly. Buy what you can afford and get out as much as you can, and don't look back or second guess.  You will be much happier in the end. JMD.",0
AMEN!!!. JMD.,0
I Say AMEN AGAIN!  JMD.,0
"Yes & no ,. consideing my most expensive televue was the 21 ethos at £420 , bought a few years ago when televue had their big sale I got mine a bit cheaper on top of that off German eBay just before the end of the sale.. If you're lucky enough to get them at that price then they are cheap as chips, they are very expensive now but I would say they're worth saving for..",0
"I have Radians, Naglers of different types and focal lengths, of which nearly all were bought used.  I think everyone acknowledges that most new Astronomy gear are priced to the limit that the Dealers think we can take.. Televue ep's are expensive but whether they are over priced is debatable,. although they come close in the context that it is hard to justify the benefit of getting an ep around £600/£800.  I know astronomy is a fairly small market compared to other stuff like domestic electricals, etc, and that manufacturers and deals need to cover running costs as well as R&D but sometimes stuff is over priced.  Having said that, I'm a freshwater fisherman, and some of that stuff is definitely overpriced.   So is Televue gear expensive.......yep, but worth it.  I try to buy good used ep's as much as possible and have had a lot of, to me, bargains, and usually can justify it to my wallet.  But it is nice to fantasise about those ep's, or whatever, which are out of reach temporarily or permanently due to the expense......you've got to be able to dream!!.",0
"Yes and No?...........I agree with you, Nevy,......well, kind of, sort of Yes and No.",0
"Well said , I think",0
"I don't have any TV eyepieces. I don't have any fast scopes. My scopes are F/10, F/14 and F/12, and F/6.5. Lesser quality eyepieces perform very well in my scopes. Or maybe I don't yet know what I'm missing. I only observe on tracking mounts and prefer modest fields for planetary observing.  And I've only recently really got back into the hobby after a roughly 20-year hiatus.  There are lots of things I've wanted to buy in the past year, and modern mounts and a Mak and a 80EDF refractor were higher priorities for me.  Plus, I tend to try to be thrifty.. Nonetheless, I don't see TV as overpriced. I realize that there is a big difference between optics that are pretty good and optics that are really good.  The difference between a cheap 70-200mm zoom camera lens and a high-end 70-200mm 2.8 are significant, but so is the difference in price.  However, you reach a point where incremental gains are only achieved with more substantial increases in price.. Moreover, I sincerely appreciate the leadership Televue has provided in the history.  When I started in this hobby, plossls seemed exotic and high-end.  Widefield eyepieces outside of Erfls and Konigs were a rarity and their performance wasn't the greatest.  Now plossls are considered low-end. 60-degree eyepieces of excellent quality are widely available and very affordable.  And we have numerous choices in the 68-70, 80-92, and even 100-degree classes.  It is my opinion that a big reason we have all these choices is that Televue has set the mark high, and left enough of a gap for other manufacturers to aim a bit lower and a bit more affordably. For this, I am most thankful.. I hope to have some TV eyepieces in the future, but that purchase probably won't come until I buy a scope at F/5 or lower. But some day, I will build the computerized Dob that I'm designing in my head, and to get the most possible out of it, I will need that 31mm Nagler....",0
"Thing is to find something you like and stick with it, unless your needs change. As for prices, maybe. Its sort of like automobiles. If all you want to do is get from point A to point B then anything from a Kia to a Prius will do. On the other hand if you want to enjoy the trip maybe a Corvette or a Mercedes is what you want.. I worked for Gary Hand for years and as a result I got first crack at anything used that came in. I looked thru a ton of premium eyepieces over time. A long time ago (late 60's) I settled on a then new set of UO Pro orthos plus the 16mm Konig and until the 90's I was happy with them. Isuffered fromboth near-sightedness and astigmatism and it did not really bother me. But at that time I decided to sell off all the ones I had and get ones with a minimum of 20mm of eye relief so I could use my glasses and get a better view. At the time that meant TV Radians, Pentax XLs, and Vixen LV/LVWs.Tried lots of them out. Owned a few of each. Ended up settling on a set of Pentax XLs. Still have them. Yes there are better ones out there. But considering my issues am I going to gain much? No, because I really can't get my eye close enough to use anything over about 70 degrees. I did not find the Pentax XWs were that much better thru my eyes to pay a big premium on. And anya $500 eyepiece would be a waste of money. Tried contacts while playing basketball in HS/college and had to many issues. Finally about a year ago I found I was getting cataracts in my right eye so opted for lens replacements. Went with far-sightedness for a number of reasons plus did not get astigmatism correction ($$$ and advise from a Ph.D friend), so I still need glasses if I want perfect correction, but for day to day its great anyway. So for me the expensive eyepieces are not justified price wise. I would be paying too much for too little. YRMV. My gut feeling is Al would not have brought out some of the really expensive eyepieces he has except that others have brought out some less expensive ones that come close to his at a much cheaper price point so he had to respond. Which means they had to be even more expensive than the ones he already had out to surpass them in performance. And while he has cut costs by going to Taiwan, which today is not a quality issue, who knows how much they really cost to make. The only way to decide is look thru them. I would never buy an eyepiece based on hearsay. I would check out my friends and a couple of star parties to see if I could find one to look thru. And for what its worth Al's eyepieces are optimized for scopes in the F5-F8 range from my knowledge..",0
"I my opinion the answer is no, Televue EPs are not overpriced, nor are they any where close to being underpriced.. But TV commands the pinnacle of the EP market (available to amateurs).. Here, one gets a well designed, brilliantly executed, nicely packaged EP, with great coatings, at a premium price.. The only EPs, in my collection that are not TV are EPs that TV has no comparable product.. You may cry at the cost of buying one, but when you first use it you know you will never cry again..",0
"As you can see from my sig line I own all of the 68° and 82° ES eyepieces. During the Televue sale I got two Delos in a trade in of my ES152 refractor. I liked them so much that I bought 3 more during the sale. If they had not been on sail them I wouldn't have bought them, too expensive for my taste. They are great eyepieces but my ES 68° eyepieces hold their own against the Delos. The Delos have a ""Port Hole"" experience that I really like. Their ER is very good also. These are the first and only TV eyepieces that I have ever owned. The ES eyepieces get within 5% to 10% of the quality of view of the TV eyepieces. With my eyesight and scopes I can't see paying the extra $$$ for the TV eyepieces but that's just me. If you want top of the line, premium equipment, then you will have to pay the price. Al Nagler deserves every penny of what he earns from the sale of his eyepieces. He didn't get into business to make a ""little"" income!!.",0
Youse knuckleheads arguing about eyepieces when pet rocks are selling for $85 and up?. http://money.cnn.com...-rock-sold-out/.,0
I am sure on some pet forum someone is asking whether Nordstrom's premium pet rocks are worth it compared to generic pet rocks..,0
No they're not over priced. TeleVue eyepieces are just expensive,0
Exactly.. People spend what they want. Many times it doesn't make sense..,0
No..,0
"Well I am now a little over five years in this hobby. My first set of eyepieces was Meade QX's. At a star party I had the pleasure of trying a few different 13-14mm eyepieces trying to find one for a gap in what I owned and blind testing the Nagler 13mm was the best hands down. The Nagler over time proved to be so much better than my Meade's I bought a Nagler 9 but at a star party I tried a Pentax 10, so Nagler 9 by-by hello Mr. Pentax. I bought all the eyepieces that are now in my case one at a time and the QX's have been given to a friend. Each has earned it's place in my case, check my signature. By the way TeleVue's are by no means the most expensive check Leica or Nikon.. I am a nob compared to many on this forum and do not profess to be an expert. The Televue's I own out performed for me the others that they were compared to.. Bruce.",0
"OP. nope. tried pretty much everything out there. I would people save up and get some TV Eps. Once a brand come out with a EPs as good or better than TV and Cheaper then i would say TV are overpriced. however on the martket right now there actually reasonable priced for high end performance. personally i think some other EPs are way over priced vs what they can do. dont get me wrong there are some gems out there that aren't TV. But i highly recommend the TV Delos Eps for DSO and if you like a bit wider Ethos. only thing lacking IMHO from TV is a high end planetary EP. yes the TZ zoom is nice but not a TMB SMC or ZAO or Pentax SMC or CZJ etc. still love it just wish they put out a ortho set say under 8mm plossl say a. 7,6,5,4mm high end planetary orthos.",0
If you Google hard enough you'll find that blind tests HAVE been done over the years. From memory the results were in favour of Tele Vue most of the time but there were a significant number of times where that wasn't the case. It just goes to show that everyone is different and we really need to decide for ourselves..,0
"Thanks, I guess I didn't google hard enough. I found this comparison test.. http://www.brayebroo... vs Brandon.pdf. Interestingly and relevent to this thread is the author's conclusion, who said: ""However by far the best value is the GSO Plössl. It consistently outperformed or rivalled the TV Plössl at roughly half the price, even. less if bought cased via Amazon. Not only does the GSO Plössl represent the best value, it ranks overall a better planetary eyepiecethan the TV Plössl, exceeded only by the Brandon which costs almost ten times more."".",0
Good example..,0
"I like the idea that some others have put forward: there's a difference between expensive and over priced. Expensive things cost a lot. Over priced things cost more money than the benefit they give. Something can be expensive without being over priced. To me, the Tele Vue eye pieces I have are not over priced. The Tele Vue eye pieces I don't have I don't believe to be overpriced, I just don't have a use for them for the scopes I have and the observing I do.. So, the Tele Vue eye pieces I have:. I like the longish Naglers for the wide field when looking at extended objects. As I said, I don't have the really long focal length Naglers (26mm and 31mm) because I have other long focal length eye pieces that work well for me.. I don't have any Panoptics because I have Naglers, so I don't feel the need for 68 degree eye pieces.. I like the Radians for their eye relief and short focal length. When I use high magnification I don't look at big objects, so a wide field really isn't necessary.. I like the Plossls for minimal glass when observing the moon, planets and double stars, which is what I do with my driveway scope. Deep sky is unsatisfying from my house. I think I need a second 21mm smoothie Plossl, because it's my favorite galaxy eye piece.. Sure, there are other eye pieces that are more expensive than Tele Vue: Nikon, Docter, Takahashi, Zeiss, TMB monocentric, Clave, etc. I've been fortunate to look through a few and they are really good. I think those that I've looked through are over priced, so I don't own any. Thank goodness for those companies that others appreciate the difference enough to pay for it.",0
"Are the Nordstrom Pet Rocks worth it compared to the regular pet rocks? I think I can answer with some confidence that no, they aren't. The pet rock was a cheap, funny present in the 70s. Now it's a worn out joke, and charging $85 dollars doesn't make it funny. A $10-$15 Vite/Svbony 23mm or 10mm is a cheap, semi-gag gift that's actually worth something.. And Televue? They really took off with the advent of the Nagler and the Dob revolution. The Dob tended to be a cheap design, bringing large aperture and phenomenal savings to their owners. People then blew all their money on expensive eyepieces.. Like jallbery, I have favored medium to long focal lengths, and I prefer tracking when doing some serious viewing. Unlike jallbery, I have owned some Televue equipment, and looked through others. The Televue stuff I own, I no longer use. Frankly, much of it wasn't that good (early Barlows, a Nagler 9mm, a Panoptic 27mm, a Plössl 32mm smoothie from the 80s). Other items, like the Big Barlow, were very good, but in the end not practical for the scopes I use. The stuff Televue excels at, the handling of fast f-ratios, and very wide fields, are things that I don't place a premium on.. Are they overpriced? Again, much of what the competition offers, I'm not that interested in. My favorite implementation of a 100° eyepiece is sold by Lunt. The optics are good, but I saw it in an f8 scope, which is not fast. I mainly like it because of the ergonomics. My experience with Explore Scientific is likewise limited, but I have seen poor light control in their 3x Barlow, and I don't like the ergonomics of their 100° eyepieces.. I tend to like the ergonomics of my eyepieces, and the ones I have kept are modest, but very good performers, with a couple of more expensive exceptions, also very good performers..",0
Of someone who admits to having a dislike for TeleVue...  Read it.. Jon.,0
