text,n_likes
"Explore1’s simple question seems to have touched a nerve judging from the number of responses for this thread. The question isn’t simply whether Televue is too expensive, but rather how we should spend two of our most precious resources: time and money. Last Friday night I wanted to watch a movie but I didn’t want to waste two hours watching a mediocre move so instead I spent an hour reading various synopsis and reviews before I realized it was too late to watch a movie. Similarly, I’ve probably spent more time reading reviews and forum post to optimize my equipment than actual observation. Like the beefcake who drives takes the elevator to the gym, how many of us ignored the daily subtle and sublimed beauty of light all around us, only to focus on capturing a bit more distortion-free photons from a visually static object a few arc minutes across. We do this because we how we spent our time and money is part of a narrative of who we are and the meaning of our lives..",0
"Dear Lift Off, I agree..",0
"An eyepiece line (pentax XW) quite similar in performance to one of TeleVue's line (Delos) costs about the same (or did when they were still in production). Yet, I have'nt seen too many threads asking if the Pentax XWs were overpriced..",0
"Tele Vue seems to have more ""hits"" and fewer ""misses"" than their competitors. While some of their eyepieces haven't been perfect, like the severe kidney-beaning 13mm T1 Nagler, the low eye relief 4.8mm Nagler (specs say 7mm, most observers say 6mm at best) and the 12mm, 17mm and 22mm Nagler T4's have a completely idiotic eye cup height adjustment scheme. In some respects, I guess you might say they're not afraid to use customers as ""beta testers"". The flip side of that coin is that they do seriously listen to customers so they can avoid making the same mistakes and hopefully improve each new generation of eyepieces. For example, unlike the earlier Nagler T4 line, the eye cup height adjustment in the Delos line works beautifully. Early on, besides their superior coatings, Tele Vue's use of blackened edges on all of the lens elements in each eyepiece made such a visible improvement that it forced the whole industry to respond in kind. I've done serious head-to-head field test comparisons and, while it was sometimes very close, TV eyepieces never lost one of those battles. I was ""wowed"" in 1985 and I'm still ""wowed"" by their current eyepieces today. Optically, we all want perfection but reality is that spending $500 (or more!) on an eyepiece does not guarantee perfection, no matter who makes the eyepiece. There are always going to be compromises. I've had a lot of eyepieces over the years, they come and they go, but my best compliment to the high-dollar value of Tele Vues is that they have almost all been ""keepers"". So, when I buy a Tele Vue eyepiece, I know what to expect...I'm okay if there's a minor compromise or two and I'm always confident that I'll be more than pleased with the the performance...and, at the end of the night, isn't that what counts?. Disclaimer: I have no affiliation with Tele Vue or any astronomy-related manufacturer or distributor..",0
"Agreed. I am still curious whether the Topic Starter, here, will share his or her experiences, if any, with Tele Vues..",0
"I suppose I contributed to some of the controversy by stating I felt the TV plossls were overpriced.  So, for the purpose of clarity and in an attempt to further explain my view:. My comments were about the TV plossls 15, 11, and 8mm as well as the TV 3x Barlow.  I own those occulars.  I thought I made it clear that my comments concerned only those items.  I do not own any other TV eyepieces.   I wrote that I felt the plossls were over priced because some competitive brands provided  views that I felt were very close if not better then the TV plossls.  I made that statement because the TV plossls I own had very tight eyerelief and FOVs. I also wrote that my  comments were subjective, by which I meant was based on my perception.  I also noted the provided views were great just too tight for me.   I also pointed out the TV plossl constructive was first rate.   Since the competitors plossls are 1/3 to 1/2 the cost of the TV plossls I believed the TVs were overpriced.   I didn't consider any other factors but performance,construction and cost compaired to other brand plossl EPs. I also pointed out the TV 3x Barlow was a great buy and a top notch occular, well worth the price.  I don't have any interest in any company either TV or its competitors.  I was just participating in what I felt was a very interesting discussion.   I hope this clears things up a bit.",0
"Maximizing profits does not necessarily mean ""the highest price"" (I'm not sure what you mean by ""that will sell""). What we often find is market segmentation. So you can buy a particular North Face coat for $200 from North Face, or at a 10-20% discount from many dealers, or for $100-$120 at the end of the season from discount merchants, or on Ebay unlabeled for $80 shipped.. Then there is the secondary (used) market.. For astro equipment the discounts are much lower, but the secondary market (which most often supplies products that are good as new) for 50-70% of the new product market..",0
"@ Shneor,. The clothing business runs on margins of 100% to 140% - I would know as I was CFO for a company that sold luxury goods and average labels (clothing, shoes, jewellery, watches).. Nothing comparable to eyepieces where margins are tighter as there is R&D involved and a true cost to the product. The average TV eyepiece has a lot more cost than a Louis Vuitton bag which costs a negligible amount to manufacture, but is charged for a few hundred dollars (the cheapest one) for the privilege of ""prestige"" or whatever.. While a well executed eyepiece can provide better views, a Louis Vuitton bag carries stuff in exactly the same way as another bag. But people pay through their teeth so that someone will open the door for them at the boutique and suck up to them, to make them feel important and also for the ""look at me, look at me"" factor.. @ Lenny,. Plossls by design have low eye relief as you progress to plossls from low to high magnifications. This has nothing to do with TV, it is the design of Plossl eyepieces.. You pay for better quality materials, better manufacturing tolerances, better resale value and yes, a certain ""I own TV eyepieces"" prestige if one ascribes to that. How much that is worth to someone is entirely subjective as you note and I thank you for stating that as people like to apply their experiences globally and declare them to be a gospel.. -------. My 2c on the matter is that without knowing the price structure of TV we cannot be sure if they are charging too much. But from feedback occasionally posted here by reputable vendors, the margins appear to be pretty low.. Even low margins does not mean that the eyepieces are not overpriced. They are overpriced relative to other eyepieces with similar properties in regards to their characteristics (eye relief, focal length, AFOV), but this is a different story performance-wise.. If you feel that they perform better in some regard, then they are not overpriced. If you feel that the difference in performance is not that much to warrant the difference in price, then for whoever considers buying them, they will appear overpriced.. In the end, these eyepieces perform well as indicated by their popularity. But so do other brands. You choose based on what your head, heart and wallet say - depending on who wins..",0
"Plossls are scaled designs with respect to eye relief. Know the focal length and youcan calculate the eye relief across manufacturers. They generally seem to be the same across lines when I have checked, although I have only checked a few. But I guess there is not a single Plossl design, so perhaps you are comparing to a different variant. Plossl eye relief gets short below around 13mm focal length. That is one of the things that made the Naglers such a welcome relief...literally, a very wide field with comfortable eye relief. Even the 7mm T1still had 10mm of eye relief despite also being a scaled design. After using a 9mmT1 I found few reasons to use my 7.4 or 13 Plossls, and soon added a 7mm T1.. As far as price goes, I tend to buy things that I have some confidence in. Bargain Plossl's can be decent and I have some free ones that came with scopes, but they usually are cutting some corners. So when I found I had a needof a 32mm Plossl after all these years, I went back to the well with TV again. I don't discourage folks from buying or using less expensive builds, but I am more hesitant to recommend them because I don't know how picky the user will be or what the build quality will be..",0
"The number of telescopes Astro-Physics produces is limited by Roland's output, not by the cost. It's a different business model and obviously it's been successful in providing high quality telescopes (and mounts) to the amateur community. You could look a little further than just the number of Astro-Physics scopes produced to understand Roland's thinking. He led the way, he showed how to do it and people learned. All those TMB triplets that have been copied, where did TMB spring from? When you look at a ED triplet, think to yourself, ""Roland had something to do with that."". I find his business model refreshing, it shows that an enterprise can be successful if it's priorities are more than just making as much money as possible. Some folks have trouble thinking in those terms. I think he's wiser than you might think. He did his way, he enjoys life and his goal of raising the quality of optics available to the amateur community has been reached. This is a good read, posted in at least 3 forums here on Cloudy Nights in the past day or two:. The Future of Astro-Physics. ""P.S. And for the fellow that asked about a scope since 2007 in the Cloudy night's post above - yes, consider purchasing a scope from the many fine instruments available. I probably won't get around to making your scope ever, and that is not a bad thing. There are so many choices now that you should never wait if you really want a scope.. Rolando."". Jon.",0
"In 1996 I had a Orange Tube C-8 and three boys in college. There wasn't much money for extras but I wanted to purchase a 32mm Plossl to provide the widest possible field of view for my C-8.. Fortunately, the 1996 issue of Sky and Telescope had a comprehensive test of 31 different Plossls. I read that report carefully and decided to purchase the 32mm Celestron Plossl. It was about half the price of the TeleVue unit and looked to be a very solid eyepiece. I still have that eyepiece, in the past few years, that series has come to be called the ""Halloween Plossls"", it's been a good eyepiece. Amymore, I rarely use it for astronomy but over the years I have used it for Digiscoping, (afocally imaging birds) and taken many thousands of images, it has shown that indeed the original review was on the money, a good solid eyepiece with excellent on-axis sharpness. This image is particularly appropriate for an astronomy forum, it's a Stellar's Jay.",0
Well resumed..,0
Nice bird...Clean and flat enough for photos!.,0
"OK, how about this:  I own 3 TV Plossls and believe when compared to my other plossls they r overpriced.   To me it's a matter of performance, construction, and cost.   I am only comparing th TV plossls to my other brand plossls with a similar lens configuration.  It's my personal opinion.  I am aware of the various trade offs when it comes to eyepieces.   I prefer a little more Eyerelief.   My TV 3x Barlow is great and well worth the money. As far as the posts I made concerning economics and the various definitions, etc.  those are what I was taught and were considered the prevailing belief when I was in college 25 years ago.  As far as I know the field of economics has not changed when concerning price establishment.",0
"As an engineer, overpriced means I am paying for something I am not getting. The question of value, whether I am willing to pay for whatever it is, that's a different question. For example, if I want the best possible coatings, that costs money. Just because I am not willing to pay for the coatings does not mean it's overpriced, it just means I am not willing to pay for the coatings. 15 years ago, a Hadland 200 camera about $400,000. Is that overpriced?  To the person who needed it's capabilities, 5 nano-seconds per frame, there were no other choices.. You got what you paid for, it wasn't overpriced.. Jon.",0
"Many years ago, when I started in this hobby, long eye relief was only obtainable in long focal length eyepieces, and even some of them were fairly tight.. But today you can get at least 417 different eyepieces with 20mm or more of eye relief, and there are a large additional number that just miss that mark.. So there is no shortage of long-eye relief eyepieces unless you want 82° or more of apparent field.. There, there are some, but they are not common.. Other than that, though, we have a LOT of long eye relief choices, and more coming out every day..",0
"In my experience there is no target that can only be seen in Tele Vue ep's.. At the same time, they are worth their price..",0
"I have several TeleVue eyepieces. I bought all of them used. To me, they are a tremendous value. Here are some areas that I've noticed they exceed the competition. Construction/Machining. The body components are made to very tight tolerances, and seem to have very high sample consistency. My 11mm Plossls slide slowly into the eyepiece holders of my binoviewers, and there is no difference depending on which side I put each eyepiece into. I've never had to mess with centering, and they are perfectly parfocal. The only other eyepieces to achieve this are my Fujiyama Orthos. All others require tweaking, recentering, rotating, etc. to merge properly.. Another observation - I committed the heinous sin of modifying my 11mm Plossls to make them more like volcano top eyepieces, to improve eye relief. I tapered the top of the eyepiece body using my lathe. Since this is not a critical operation, I didn't bother with precise centering or truing up - I merely chucked the eyepiece by the barrel. The upper body of the eyepiece on both samples turned true within a few thousandths. This shows very high tolerances in the threading interface between the upper body and barrel. Coatings. In comparing the TV 55 Plossl to the late-model Meade 56 Super Plossl, the TV coatings are far superior. I held both up to a bright light source, and the Meade easily showed internal reflections on the glass. Not even a hint of reflections were seen on the TV.. Internal blackening. In every TV eyepiece I've looked down, it's like peering into a pitch black cave. Their internal blackening/baffling is excellent. Most other eyepieces have a multitude of lighter and somewhat reflective (black anodized) interior surfaces. Even the black paint they use on the barrel its self seems to be much darker and ""blacker"" than what I've seen from other eyepieces.. Overall, my experience shows that TV pays a lot of attention to small details to make their products very high quality. That kind of scrutiny definitely adds to the cost, but can have tangible benefits in critical viewing scenarios..",0
"I've used more Televue stuff now, and had more time with the alternatives. Would I say it's worth the cost? Well, it depends. The cost is significant, and the alternatives are often pretty good. Meade UWAS and ES82s are really good and it's better to have those than to maybe be thinking of getting a Nagler someday, or skimp on the rest of your kit. But if you can afford them, yep, they're better. And you'll be using eyepieces every time you observe, so it's a good thing to put money into.. I think for most people I would still recommend starting out with cheaper eyepieces. Most people will need years to absorb the substantial cost of building a Televue eyepiece collection, and eyepieces resell well, so it's a good idea to get something to use in the meantime. Or maybe they'll be so good you'll never see the need.",0
"I would say::. You can always buy something cheaper and take the chance of having to buy the more expensive one later on.. I, personally, choose not to have to buy the item a second time..",0
"I'm on the Yahoo AP group, so I saw the original post. Very appropriate timing, and sheds some light on things. For example, RC is putting procedures in place to turn things over to another optician(s).. And there is a new fast imaging visual scope announcement forthcoming. Depending upon what it is I'll probably get on that list to use with my NV tube, even though I will probably have macular degeneration by the time they deliver.. As to how ""noble"" his business philosophy may be - I make no presumption that profitable growth and success is somehow ""dirty"".. It is surprising (to me anyway) that he chose to invest more in mounts than optics. Mechanical engineering and machinist talent is far more common than the type of talents he has in optical design and fabrication. Perhaps mounts have a higher profit margin.. Better judges of his priorities may be people on that ten year (or whatever it is now) wait list. I suspect most of them want the finest equipment to fulfill their lifetime visual/creative aspirations. Watching the prime of their lives fly by while waiting on the pinnacle of perfection is probably a bitter pill to swallow.. Speaking of which,I suspect once RC completes his Hawaii observatory, he won't be pushing much glass at all. I wonder how those folks on the list will feel about getting a non-RC telescope?.",0
"What happened with the Dobsonian was interesting as it led to a change in and a resurgence of ATMing. Fewer people were grinding their own mirrors in the 1970s, but they began building Dobs and purchasing the mirrors to go inside. The Dob is many things, but scary to work with isn't one of them. That was the market Nagler saw when he developed the Nagler.. Word is that Al delayed the release of the Nagler 13mm from the late 70s to 1980-81 to give his new company some credibility with a line of Plössls first, before venturing out there with an unknown (expensive) design. By delaying a couple of years, he got very lucky. Coulter released the Odyssey 1 in May 1980..",0
"I think I would believe that of more people, if I didn't keep reading tales of people buying and selling eyepieces (Televues included), and often buying and selling the same eyepiece multiple times.",0
"Some buy equipment to look through, and some buy with resale value in mind. IMO, TV is a cult, and their believers are fanatics. In certain circumstances TV EP's DO perform a LITTLE better than others that cost 100's of % less. Innovation is no reason to laud a brand, value is a reason. The TV fanatics do themselves a disservice by constantly injecting themselves where they are not wanted...I could start a thread with ""looking for some good cheap kellners/huygens, NO TV product/fanboy comments needed"" and they'll definitely be in there spouting ""Ethos"", ""Delos"", ""Nagler"" like every one of them owns major shares and is desperate to keep a failing company float or something.. It's really disgusting, if TV was ""SO GOOD"" everyone would already know it. So why do people sell them at half price used? Why EVER sell them? Type 72 Naglers coming soon....LOL If TV stuff was THAT GOOD they wouldn't have to troll every thread where TV WASN'T being considered. And it's NOT as if ES or any other company couldn't produce an equally corrected EP and charge the same inflated price. YES, they are over priced. I make the determination of what is reasonable and what is not. TV products may be a little better, but not $150-$400 better, and 95% of people worldwide without lots of disposable income will heartily agree with me. I AM going to buy the 11 and 8mm plossls and the 3X barlow. I'd like the 55mm plossl, but for the amount of use it'd get I'm sure I'll do just fine with the Meade 56mm instead. Here's a ""problem"" I have with the (apparently) anti-EAA crowd, IF EAA was 1st, and glass EP's were new, I believe you'd all be railing against them. Same with the TV boys, got too much invested.... As a visual purist, I'm taken aback by the # of AP threads in ""new content"" that I have to wallow through. I Now it's my turn to brag, I got a pair of Tasco 7X35 318Z (10 deg) in perfect shape with caps, case and owners manual for $10 the other day. Should I troll everyTV thread and say ES is a better bang for the buck? How would they like that? TV doesn't care about you or they'd offer waterproofing and make smooth side barrel replacements optional. Harley owners use that same ""resale value"" line when all else fails. (the only difference being TV isn't obsolete junk but both ARE overpriced) OK, TV fanboys, AP'ers, Off topic posters, EAA haters and Hardlys...did I miss anyone? Is a $90 TV 11mm ""better"" than a $9 Vite 10mm? In exactly what way? (besides edge correction at extremely short F/L's) I'm a mechanic and I know Snap-on tools aren't necessary...exact same thing, a status symbol. My $100,000 Snap-on box of tools is not ""better"" than my $1,000 Craftsman box, end of rant.",0
"Rebuttal #1 Good mechanics I know not only work a full time job, also have a (driveway, yard, garage) full of cars they work on the side. Never lack for spending money. #2 Most everyone owns / displays status symbols. Some are ostentatious in their humility. #3 You're a clown. Funny like a clown. I'm amused (Goodfellas) #4 The ""other"" group (pick one)  is certainly misguided in their astronomical choices, whether  activity or equipment. Most are irredeemable I know, but every now and then I find a red pill. Never online, always in the observing field.",0
,0
"I am happy that Tele Vue has some lower-priced competition. I think Tele Vue spurred everyone to raise their standards of quality and performance.. Here's a historical data point. The Zeiss Astro-Plan, a flat-field König derivative (I think), cost $140 in 1971. That is about $900 in today's dollars. And today $200 will buy much better eyepieces, simply because of technical progress..",0
"Hi again:  this is a thread that started with the simple question, ""are TV eyepieces overpriced"". I didn't start the thread, but I wrote that yes, I thought the plossls were overpriced.  I have consistently said it is my opinion they are overpriced and I stated why I felt that way.  I noted the problems with the tight eyerelief and that some competitive brands provided as good a view with a little better FOV and eyerelief.   Plus they are 1/2 to 1/3 the price.  My opinion concerns only their plossls (the 15, 11, and 8mm). and their 3x Barlow because I only own those occulars. I know that a person can buy the TV plossls because they appear to be built better and there is better quality control etc.   But I took all of that into consideration. I still believe they are overpriced when compared to other plossls.  So, I hope that we all keep our heads about this issue.  I can tell that some of you are passionate TV supporters and that's fine by me.  I respect you for your opinion.  Finally, I have read all of the contrary posts and have benefited from the knowledge gained.",0
"I am not a Televue fan boy, but Delos line simply gives to me high optical quality, good ergonomics, large field, and big comfort through large ER, that is exactly what I wished.. That was before the existence of Morpheus line, cheaper and very good, but not adjustable.. Nikon NAV-SW ate more expensive, have not the same ER, but are smaller, that's true.. Anyway, all my Deloses are second hand, but if not, I think that I could have been able to buy them new, on a longer period.. All things considered, if I had to look for good eyepieces, I'd buy Delos again once more, with maybe one or two Pentax XW, I love them too but I wanted a coherent line.. You know what ? I'm happy !",0
"Also, the reason Tele-vue doesn't sell replacement smooth barrels is pretty obvious if you've ever looked closely at their eyepieces. A lot of them (perhaps most) have lenses and other parts within the barrel! So it's not like you could just unscrew the barrel and screw on another one. It would be major surgery to remove and replace the barrel elements, and you could easily get them dirty or get the spacing wrong..",0
"Wow, someone needs a time out. Why don't you tell us how you really feel? Your opinion is as valid as anyone else's but you seem to have a deep seated hate injected into yours as far as TeleVue and other folks opinions are concerned. You don't have to disrespect anyone when stating your opinions and your feelings about the eyepieces others choose to buy. Simply say they are not worth it, to you. Myself, with the premium optics I put in my homemade telescope I choose to use the best I can afford which includes a Paracorr to correct my fast mirror. I bought most of them used and in my opinion they make that rare perfect night out under the stars more perfect.",0
